{
  "schema_version": 1,
  "corpus_id": "lv-001-ja-smoke",
  "version": "1.0.0",
  "revision": "lv-001-ja-smoke-v1.0.0+sha256.9ec9ee58d6398694",
  "status": "text-reviewed",
  "artifact_kind": "text-metadata-only",
  "classification": "synthetic",
  "language": "ja-JP",
  "normalization_revision": "liveconv-jp-nfkc-kana-v1",
  "category_targets": {
    "ordinary_conversation": 6,
    "contact_center_language": 5,
    "telephone_and_postal_numbers": 5,
    "addresses": 4,
    "dates_times_money_and_units": 5,
    "proper_nouns_and_polyphonic_kanji": 5,
    "code_switching_and_identifiers": 4,
    "interruption_scenarios": 4,
    "noise_and_degraded_transport": 2
  },
  "requirements_covered": [
    "JP-001",
    "JP-002",
    "JP-003",
    "JP-004",
    "JP-005",
    "JP-006",
    "JP-007",
    "JP-008"
  ],
  "license": {
    "spdx_id": "CC0-1.0",
    "scope": "corpus text and metadata authored for LV-001",
    "redistribution": "permitted-without-restriction",
    "third_party_material": false
  },
  "provenance": {
    "origin": "project-authored",
    "derivation": "requirements-driven manual composition",
    "source_documents": [
      "docs/product/requirements.md#japanese-speech-requirements",
      "docs/experiments/evaluation.md#corpus-design"
    ],
    "contains_customer_data": false,
    "contains_recorded_voice": false,
    "reading_review": {
      "state": "engineering-reviewed",
      "scope": "display-to-spoken mapping, entity spelling, and category coverage",
      "native_speaker_validation": "not-performed"
    }
  },
  "audio_assets": {
    "included": false,
    "status": "not-generated",
    "checksum_manifest_status": "not-applicable"
  },
  "revision_policy": "Published revisions are immutable; any metadata or utterance change requires a new semantic version, revision identifier, and checksum.",
  "integrity": {
    "algorithm": "sha256",
    "canonicalization": "utf8-json-sort-keys-compact-without-revision-and-integrity-v1",
    "digest_scope": "complete document excluding revision and integrity",
    "sha256": "9ec9ee58d6398694cf26928c530252230faab197a5296d3c2fdcf89da66ade6b"
  },
  "utterances": [
    {
      "id": "LV001-JA-001",
      "primary_category": "ordinary_conversation",
      "display_text": "はい、こちらの声は聞こえています。",
      "expected_spoken_text": "はい、こちらのこえはきこえています。",
      "canonical_kana": "はいこちらのこえはきこえています",
      "exact_entities": [],
      "requirements": ["JP-007"],
      "tags": ["acknowledgement", "phrase-boundary"],
      "pronunciation_review": {
        "state": "engineering-reviewed",
        "basis": "standard modern Japanese conversational reading"
      }
    },
    {
      "id": "LV001-JA-002",
      "primary_category": "ordinary_conversation",
      "display_text": "すみません、最後の一文をもう一度お願いします。",
      "expected_spoken_text": "すみません、さいごのいちぶんをもういちどおねがいします。",
      "canonical_kana": "すみませんさいごのいちぶんをもういちどおねがいします",
      "exact_entities": [],
      "requirements": ["JP-007"],
      "tags": ["repair", "polite-request"],
      "pronunciation_review": {
        "state": "engineering-reviewed",
        "basis": "standard modern Japanese repair request"
      }
    },
    {
      "id": "LV001-JA-003",
      "primary_category": "ordinary_conversation",
      "display_text": "次はどの手順から始めればよいですか。",
      "expected_spoken_text": "つぎはどのてじゅんからはじめればよいですか。",
      "canonical_kana": "つぎはどのてじゅんからはじめればよいですか",
      "exact_entities": [],
      "requirements": ["JP-007"],
      "tags": ["question", "procedure"],
      "pronunciation_review": {
        "state": "engineering-reviewed",
        "basis": "standard modern Japanese interrogative reading"
      }
    },
    {
      "id": "LV001-JA-004",
      "primary_category": "ordinary_conversation",
      "display_text": "承知しました。内容を確認して進めます。",
      "expected_spoken_text": "しょうちしました。ないようをかくにんしてすすめます。",
      "canonical_kana": "しょうちしましたないようをかくにんしてすすめます",
      "exact_entities": [],
      "requirements": ["JP-007"],
      "tags": ["acknowledgement", "two-phrase"],
      "pronunciation_review": {
        "state": "engineering-reviewed",
        "basis": "standard modern Japanese declarative reading"
      }
    },
    {
      "id": "LV001-JA-005",
      "primary_category": "ordinary_conversation",
      "display_text": "少し考える時間をいただけますか。",
      "expected_spoken_text": "すこしかんがえるじかんをいただけますか。",
      "canonical_kana": "すこしかんがえるじかんをいただけますか",
      "exact_entities": [],
      "requirements": ["JP-007"],
      "tags": ["turn-taking", "question"],
      "pronunciation_review": {
        "state": "engineering-reviewed",
        "basis": "standard modern Japanese turn-holding request"
      }
    },
    {
      "id": "LV001-JA-006",
      "primary_category": "ordinary_conversation",
      "display_text": "先ほどの説明ではなく、短い答えをお願いします。",
      "expected_spoken_text": "さきほどのせつめいではなく、みじかいこたえをおねがいします。",
      "canonical_kana": "さきほどのせつめいではなくみじかいこたえをおねがいします",
      "exact_entities": [],
      "requirements": ["JP-007"],
      "tags": ["correction", "contrastive-phrase"],
      "pronunciation_review": {
        "state": "engineering-reviewed",
        "basis": "contrastive Japanese phrase boundary retained"
      }
    },
    {
      "id": "LV001-JA-007",
      "primary_category": "contact_center_language",
      "display_text": "本人確認のため、お名前と生年月日を順に伺います。",
      "expected_spoken_text": "ほんにんかくにんのため、おなまえとせいねんがっぴをじゅんにうかがいます。",
      "canonical_kana": "ほんにんかくにんのためおなまえとせいねんがっぴをじゅんにうかがいます",
      "exact_entities": [],
      "requirements": ["JP-002", "JP-007"],
      "tags": ["identity-verification", "procedure"],
      "pronunciation_review": {
        "state": "engineering-reviewed",
        "basis": "contact-center verification phrase with date context"
      }
    },
    {
      "id": "LV001-JA-008",
      "primary_category": "contact_center_language",
      "display_text": "ご契約番号 LC-4821 を画面でご確認ください。",
      "expected_spoken_text": "ごけいやくばんごう、えるしーよんはちにいちを、がめんでごかくにんください。",
      "canonical_kana": "ごけいやくばんごうえるしーよんはちにいちをがめんでごかくにんください",
      "exact_entities": [
        {
          "surface": "LC-4821",
          "kind": "identifier",
          "expected_spoken": "えるしーよんはちにいち",
          "normalized_spoken": "えるしーよんはちにいち",
          "high_consequence": true
        }
      ],
      "requirements": ["JP-005", "JP-007"],
      "tags": ["contract-id", "visual-confirmation"],
      "pronunciation_review": {
        "state": "engineering-reviewed",
        "basis": "configured Latin letters and digits are individually voiced"
      }
    },
    {
      "id": "LV001-JA-009",
      "primary_category": "contact_center_language",
      "display_text": "ただいま担当部署へおつなぎしますので、そのままお待ちください。",
      "expected_spoken_text": "ただいまたんとうぶしょへおつなぎしますので、そのままおまちください。",
      "canonical_kana": "ただいまたんとうぶしょへおつなぎしますのでそのままおまちください",
      "exact_entities": [],
      "requirements": ["JP-007"],
      "tags": ["call-transfer", "hold-guidance"],
      "pronunciation_review": {
        "state": "engineering-reviewed",
        "basis": "contact-center transfer guidance phrase boundary"
      }
    },
    {
      "id": "LV001-JA-010",
      "primary_category": "contact_center_language",
      "display_text": "返品を受け付けました。集荷日は8月12日です。",
      "expected_spoken_text": "へんぴんをうけつけました。しゅうかびははちがつじゅうににちです。",
      "canonical_kana": "へんぴんをうけつけましたしゅうかびははちがつじゅうににちです",
      "exact_entities": [
        {
          "surface": "8月12日",
          "kind": "date_time",
          "expected_spoken": "はちがつじゅうににち",
          "normalized_spoken": "はちがつじゅうににち",
          "high_consequence": true
        }
      ],
      "requirements": ["JP-002", "JP-007"],
      "tags": ["returns", "collection-date"],
      "pronunciation_review": {
        "state": "engineering-reviewed",
        "basis": "explicit month-day context and standard calendar reading"
      }
    },
    {
      "id": "LV001-JA-011",
      "primary_category": "contact_center_language",
      "display_text": "暗証番号そのものは読み上げず、入力完了だけをお知らせください。",
      "expected_spoken_text": "あんしょうばんごうそのものはよみあげず、にゅうりょくかんりょうだけをおしらせください。",
      "canonical_kana": "あんしょうばんごうそのものはよみあげずにゅうりょくかんりょうだけをおしらせください",
      "exact_entities": [],
      "requirements": ["JP-005", "JP-007"],
      "tags": ["credential-safety", "negative-instruction"],
      "pronunciation_review": {
        "state": "engineering-reviewed",
        "basis": "security guidance keeps the negative instruction audible"
      }
    },
    {
      "id": "LV001-JA-012",
      "primary_category": "telephone_and_postal_numbers",
      "display_text": "お電話番号は 090-1234-5678 です。",
      "expected_spoken_text": "おでんわばんごうは、ぜろきゅうぜろ、いちにさんよん、ごろくななはちです。",
      "canonical_kana": "おでんわばんごうはぜろきゅうぜろいちにさんよんごろくななはちです",
      "exact_entities": [
        {
          "surface": "090-1234-5678",
          "kind": "telephone",
          "expected_spoken": "ぜろきゅうぜろ、いちにさんよん、ごろくななはち",
          "normalized_spoken": "ぜろきゅうぜろいちにさんよんごろくななはち",
          "high_consequence": true
        }
      ],
      "requirements": ["JP-001", "JP-007"],
      "tags": ["mobile-number", "grouped-digits"],
      "pronunciation_review": {
        "state": "engineering-reviewed",
        "basis": "digits are voiced individually with mobile-number group pauses"
      }
    },
    {
      "id": "LV001-JA-013",
      "primary_category": "telephone_and_postal_numbers",
      "display_text": "東京の連絡先は 03-6890-2468 です。",
      "expected_spoken_text": "とうきょうのれんらくさきは、ぜろさん、ろくはちきゅうぜろ、によんろくはちです。",
      "canonical_kana": "とうきょうのれんらくさきはぜろさんろくはちきゅうぜろによんろくはちです",
      "exact_entities": [
        {
          "surface": "03-6890-2468",
          "kind": "telephone",
          "expected_spoken": "ぜろさん、ろくはちきゅうぜろ、によんろくはち",
          "normalized_spoken": "ぜろさんろくはちきゅうぜろによんろくはち",
          "high_consequence": true
        }
      ],
      "requirements": ["JP-001", "JP-007"],
      "tags": ["landline-number", "grouped-digits"],
      "pronunciation_review": {
        "state": "engineering-reviewed",
        "basis": "digits are voiced individually with landline group pauses"
      }
    },